title;genre;description;director;duration;rating;image;trailerURL;streamingLink;streamingPrice
Harry Potter i Komnata Tajemnic;Fantasy, Przygodowy;Samochody latają, drzewa walczą, a tajemniczy skrzat przychodzi do Harry'ego Pottera, by go ostrzec. Tak zaczyna się drugi rok jego niezwykłej podróży do świata magii. W tym roku w Hogwarcie pająki mówią, a listy krzyczą. Niezwykła umiejętność Harry'ego, dzięki której porozumiewa się on z wężami, sprawia, że przyjaciele odwracają się od niego. Zapowiada się rok pełen przygód i niebezpieczeństw, poczynając od Klubu Pojedynków, złośliwego tłuczka aż do chwili, gdy na ścianie pojawi się krwawy napis obwieszczający, że Komnata Tajemnic została otwarta. Przedstawione w tej czarownej adaptacji drugiej części serii przygód Pottera ocalenie Hogwartu będzie wymagało od Harry'ego, Rona i Hermiony połączenia ich magicznych umiejętności, a także niezwykłej odwagi.;Chris Columbus;2g. 41m.;3.55;https://firebasestorage.googleapis.com/v0/b/flutterkino.appspot.com/o/MoviePosters%2FHarry_Potter_i_Komnata_Tajemnic.jpg?alt=media&token=3ea50e3e-7120-49db-8e7a-236708621a0f;https://www.youtube.com/watch?v=cpKr7uGo52A;https://www.youtube.com/watch?v=cpKr7uGo52A;16
Harry Potter i więzień Azkabanu;Fantasy, Przygodowy;Harry rozpoczyna już trzeci rok nauki w Hogwarcie. W tym samym czasie z Azkabanu ucieka najgroźniejszy przestępca – Syriusz Black. Harry jest uważnie pilnowany przez nauczycieli oraz przyjaciół, gdyż – jak się wkrótce okazuje – jest głównym celem Blacka. Podczas podsłuchanej rozmowy Harry dowiaduje się, że Syriusz Black jest… jego ojcem chrzestnym.;Alfonso Cuarón;2g. 21m.;3.75;https://firebasestorage.googleapis.com/v0/b/flutterkino.appspot.com/o/MoviePosters%2FHarry_Potter_i_Wiezien_Azkabanu.jpg?alt=media&token=4365debb-802e-4db3-b834-a4902e8f6ec0;https://www.youtube.com/watch?v=1ZdlAg3j8nI;https://www.youtube.com/watch?v=1ZdlAg3j8nI;19
Harry Potter i Czara Ognia;Fantasy, Przygodowy;W Szkole Magii i Czarodziejstwa Hogwart rozegra się Turniej Trzech Czarodziejów, na który przybędą uczniowie z Bułgarii i Francji. Zgodnie z prastarymi regułami w turnieju uczestniczyć ma trzech uczniów – reprezentantów każdej ze szkół wybranych przez Czarę Ognia. Dziwnym zbiegiem okoliczności wybranych zostaje czterech.;Mike Newell;2g. 37m.;3.65;https://firebasestorage.googleapis.com/v0/b/flutterkino.appspot.com/o/MoviePosters%2FHarry_Potter_i_Czara_Ognia.jpg?alt=media&token=cf39e996-2947-489f-9234-9195c2f0cc0c;https://www.youtube.com/watch?v=3EGojp4Hh6I;https://www.youtube.com/watch?v=3EGojp4Hh6I;23
Harry Potter i Zakon Feniksa;Fantasy, Familijny;Harry Potter znów spędza nudne, przykre wakacje w domu Dursleyów. Czeka go piąty rok nauki w Hogwarcie i chciałby jak najszybciej spotkać się ze swoimi najlepszymi przyjaciółmi, Ronem i Hermioną. Ci jednak wyraźnie go zaniedbują. Harry ma już dość wszystkiego i postanawia jakoś zmienić swoją nieznośną sytuację, a wtedy sprawy przyjmują całkiem nieoczekiwany obrót. Wygląda na to, że nowy rok nauki w Hogwarcie będzie bardzo dramatyczny;David Yates;2g. 18m.;3.6;https://firebasestorage.googleapis.com/v0/b/flutterkino.appspot.com/o/MoviePosters%2FHarry_Potter_i_Zakon_Feniksa.jpg?alt=media&token=c09b606e-08ce-442f-820c-9d90357ac145;https://www.youtube.com/watch?v=y6ZW7KXaXYk;https://www.youtube.com/watch?v=y6ZW7KXaXYk;31
Harry Potter i Książę Półkrwi;Fantasy, Familijny;Lord Voldemort zaciska swoją złowieszczą pętlę wokół świata Mugoli i czarodziejów, a Hogwart przestaje być – jak dawniej - bezpieczną przystanią. Harry podejrzewa, że niebezpieczeństwo może czaić się w samym zamku, ale Dumbledorowi zależy raczej na przygotowaniu go do ostatecznego starcia, które jego zdaniem nastąpi niebawem. Razem usiłują znaleźć broń zdolną skruszyć zapory Voldemorta. Harry’emu coraz bardziej podoba się Ginny...niestety, Dean Thomas jest nią również zainteresowany. Lavender Brown dochodzi do wniosku, że Ron jest jej przeznaczeniem, nie bierze tylko pod uwagę czekoladek Romildy Vane! No i oczywiście Hermiona, przeżywająca męki zazdrości, lecz zdecydowana nie ujawniać uczuć. Gdy romanse kwitną, tylko jeden uczeń pozostaje wyniosły i obojętny. Postanowił wywrzeć swoje niezatarte – choć mroczne – piętno na życiu Akademii. Miłość wisi w powietrzu, lecz za nią czai się dramat i Hogwart być może już nigdy nie będzie taki jak przedtem.;David Yates;2g. 33m.;3.7;https://firebasestorage.googleapis.com/v0/b/flutterkino.appspot.com/o/MoviePosters%2FHarry_Potter_i_Ksiaze_Polkrwi.jpg?alt=media&token=5834287e-eff9-484d-8410-f4fd827aaf55;https://www.youtube.com/watch?v=tAiy66Xrsz4;https://www.youtube.com/watch?v=tAiy66Xrsz4;35
Harry Potter i Insygnia Śmierci: Część I;Przygodowy, Fantasy;Dumbeldore przed swoją śmiercią powierzył Harry'emu zadanie zniszczenia potęgi Lorda Voldemorta. Z pomocą przyjaciół główny bohater próbuje spełnić wolę swojego mistrza, jednak nie jest to łatwe, gdyż Ministerstwo Magii opanowane jest przez popleczników Czarnego Pana, a to Harry jest teraz ściganym...;David Yates;2g. 26m.;3.7;https://firebasestorage.googleapis.com/v0/b/flutterkino.appspot.com/o/MoviePosters%2FHarry_Potter_i_Insygnia_Smierci_1.jpg?alt=media&token=d29b8f6b-1912-41cd-9657-4ad0c3ebc87a;https://www.youtube.com/watch?v=MxqsmsA8y5k;https://www.youtube.com/watch?v=MxqsmsA8y5k;24
Harry Potter i Insygnia Śmierci: Część II;Przygodowy, Fantasy;Walka pomiędzy siłami dobra i zła przeradza się w otwartą wojnę. Nikt nie może czuć się bezpieczny. Jest jeszcze Harry, który być może będzie musiał zdobyć się na największe poświęcenie gdy stanie do ostatecznego pojedynku z Lordem Voldemortem...;David Yates;2g. 10m.;3.75;https://firebasestorage.googleapis.com/v0/b/flutterkino.appspot.com/o/MoviePosters%2FHarry_Potter_i_Insygnia_Smierci_2.jpg?alt=media&token=9af5bf27-dd2b-4170-9671-f9cb52bdc492;https://www.youtube.com/watch?v=5NYt1qirBWg;https://www.youtube.com/watch?v=5NYt1qirBWg;13
Pięćdziesiąt twarzy Greya;Erotyczny, Romans;Studentka literatury Anastasia Steele (Dakota Johnson) poznaje przystojnego, tajemniczego milionera Christiana Greya (Jamie Dornan). Początkowe zauroczenie przemienia się w gorący perwersyjny romans, który na zawsze zmieni życie Anastasii.;Sam Taylor-Johnson;2g. 4m.;2.1;https://firebasestorage.googleapis.com/v0/b/flutterkino.appspot.com/o/MoviePosters%2F50_twarzy_Greya.jpg?alt=media&token=f1f54b64-ec8a-4fa0-b2e0-a93617e08ba9;https://www.youtube.com/watch?v=kRwlUVKNMR8;https://www.youtube.com/watch?v=kRwlUVKNMR8;38
